{
  "schema_version": "1.0.0",
  "id": "dr.backup-vault-restore-rehearsal.002",
  "version": "v2026.07",
  "domain": "dr",
  "tags": [
    "backup",
    "restore-rehearsal"
  ],
  "event": {
    "schema_version": "1.0.0",
    "event_id": "00000000-0000-0000-0000-000000000005",
    "idempotency_key": "scenario-5",
    "source": "example_backup_vault",
    "event_type": "restore_rehearsal_scheduled",
    "detected_at": "2026-07-05T08:00:00Z",
    "ingested_at": "2026-07-05T08:00:01Z",
    "mode": "shadow"
  },
  "expected": {
    "tier": "t0",
    "decision": "auto",
    "citing_rule_ids": [
      "example.dr.rehearsal-cadence"
    ],
    "guard": {
      "should_execute": true,
      "should_rollback": false,
      "should_trigger_policy_violation": false
    }
  }
}
