{
  "schema_version": "1.0.0",
  "id": "dr.chaos-experiment-novel.003",
  "version": "v2026.07",
  "domain": "dr",
  "tags": [
    "chaos",
    "novel-scenario"
  ],
  "event": {
    "schema_version": "1.0.0",
    "event_id": "00000000-0000-0000-0000-000000000006",
    "idempotency_key": "scenario-6",
    "source": "example_chaos_studio",
    "event_type": "experiment_novel",
    "detected_at": "2026-07-05T08:00:00Z",
    "ingested_at": "2026-07-05T08:00:01Z",
    "mode": "shadow"
  },
  "expected": {
    "tier": "t2",
    "decision": "hil",
    "citing_rule_ids": [],
    "guard": {
      "should_execute": false,
      "should_rollback": false,
      "should_trigger_policy_violation": false
    }
  }
}
