{
  "schema_version": "1.0.0",
  "id": "finops.stop-idle-dev-vm-off-hours.003",
  "version": "v2026.07",
  "domain": "finops",
  "tags": [
    "schedule",
    "dev-environment"
  ],
  "event": {
    "schema_version": "1.0.0",
    "event_id": "00000000-0000-0000-0000-000000000009",
    "idempotency_key": "scenario-9",
    "source": "example_cost_management",
    "event_type": "cost_anomaly",
    "detected_at": "2026-07-05T08:00:00Z",
    "ingested_at": "2026-07-05T08:00:01Z",
    "mode": "shadow"
  },
  "expected": {
    "tier": "t1",
    "decision": "auto",
    "citing_rule_ids": [
      "example.finops.stop-idle-dev"
    ],
    "guard": {
      "should_execute": true,
      "should_rollback": false,
      "should_trigger_policy_violation": false,
      "expected_mttr_s_max": 45
    }
  }
}
